{
  "task_spec":{
    "objective":"ship",
    "task_type":"coding",
    "effort":"medium",
    "reasoning":"unknown",
    "capabilities":[],
    "required_capabilities":[
      "tools"
    ],
    "tools":[
      "search"
    ],
    "context":null,
    "context_requirements":{},
    "tool_requirements":{
      "tools":true
    },
    "privacy":"internal",
    "risk":"medium",
    "budget":{
      "max_usd":1
    },
    "latency":{
      "max_ms":5000
    },
    "latency_limit_ms":5000,
    "workflow":null,
    "approvals":[],
    "criticality":"medium",
    "verification":null,
    "parallelism":"serial",
    "destructive_operation":false,
    "production_impact":false,
    "degraded_mode_policy":"deny",
    "metadata":{
      "future":{
        "preserve":true
      }
    },
    "schema_version":"1"
  },
  "workflow_plan":{
    "steps":[
      {
      "id":"step-1",
      "action":"implement",
      "objective":"implement"
      }
    ],
    "plan_id":"plan-1",
    "verification":{
      "checks":[
        "tests"
      ],
      "on_failure":"deny",
      "schema_version":"1"
    },
    "verification_plan_id":"verify-1",
    "fallback_allowed":true,
    "fallback_plan":[],
    "policy_version":"1",
    "metadata":{},
    "schema_version":"1"
  },
  "runtime_candidate":{
    "runtime_id":"provider/model",
    "catalog_present":true,
    "live_eligible":true,
    "availability":"ready",
    "signals":{
      "catalog":{
        "source":"catalog",
        "freshness_seconds":30
      }
    },
    "capabilities":[
      "tools"
    ],
    "provider":"provider",
    "model":"model",
    "model_version":"v1",
    "schema_version":"1"
  },
  "availability_snapshot":{
    "observed_at":"2026-07-16T12:00:00Z",
    "state":"ready",
    "signals":{
      "health":{
        "source":"fixture"
      }
    },
    "candidates":[
      {
        "runtime_id":"provider/model",
        "catalog_present":true,
        "live_eligible":true,
        "availability":"ready",
        "signals":{},
        "capabilities":[],
        "provider":"provider",
        "model":null,
        "model_version":"v1",
        "schema_version":"1"
      }
    ],
    "source":"fixture",
    "ttl_seconds":60,
    "expires_at":null,
    "schema_version":"1"
  },
  "routing_decision":{
    "selected_route":{
      "runtime_id":"provider/model"
    },
    "task_spec":{},
    "candidate_snapshot":{},
    "exclusions":[
      {
        "runtime_id":"other/model",
        "reason":"capability mismatch"
      }
    ],
    "policy_floor":"protected",
    "planner_mode":"default",
    "explanation":"selected eligible runtime",
    "adaptive_influence":{},
    "fallback_plan":[],
    "correlation_id":"corr-1",
    "request_id":"req-1",
    "policy_version":"1",
    "schema_version":"1"
  },
  "outcome_event":{
    "event_id":"event-1",
    "event_type":"completed",
    "correlation_id":"corr-1",
    "outcome":"success",
    "occurred_at":"2026-07-16T12:00:01Z",
    "request_id":"req-1",
    "verification":{
      "passed":true
    },
    "quality":{
      "score":0.9
    },
    "latency_ms":120,
    "cost":{
      "usd":0.01
    },
    "retries":1,
    "fallbacks":[],
    "provider_version":"provider-v1",
    "model_version":"model-v1",
    "details":null,
    "schema_version":"1"
  },
  "learning_event":{
    "event_id":"learn-1",
    "signal":"quality",
    "correlation_id":"corr-1",
    "value":0.9,
    "occurred_at":"2026-07-16T12:00:02Z",
    "evidence":{
      "verified":true
    },
    "metadata":{
      "source":"fixture"
    },
    "request_id":"req-1",
    "schema_version":"1"
  },
  "task_episode":{
    "task_fingerprint":"sha256:taskfixture",
    "objective_preview":"[redacted:sha256:taskfixture len=4]",
    "task_type":"coding",
    "privacy":"internal",
    "risk":"medium",
    "required_capabilities":[
      "tools"
    ],
    "tools":[
      "search"
    ],
    "approvals_count":0,
    "context_keys":[],
    "metadata":{},
    "schema_version":"1"
  },
  "workflow_episode":{
    "workflow_fingerprint":"sha256:workflowfixture",
    "plan_id":"plan-1",
    "step_count":1,
    "fallback_allowed":true,
    "fallback_step_count":0,
    "verification_checks":[
      "tests"
    ],
    "verification_plan_id":"verify-1",
    "policy_version":"1",
    "metadata":{},
    "schema_version":"1"
  },
  "outcome_episode":{
    "outcome_fingerprint":"sha256:outcomefixture",
    "event_type":"completed",
    "outcome":"success",
    "occurred_at":"2026-07-16T12:00:01Z",
    "request_id":"req-1",
    "correlation_id":"corr-1",
    "decision":"selected",
    "policy_floor":"protected",
    "selected_route":{
      "runtime_id":"provider/model"
    },
    "verification":{
      "passed":true
    },
    "quality":{
      "score":0.9
    },
    "latency_ms":120,
    "cost":{
      "usd":0.01
    },
    "retries":1,
    "fallback_count":0,
    "provider_version":"provider-v1",
    "model_version":"model-v1",
    "details":null,
    "schema_version":"1"
  },
  "task_workflow_outcome_episode":{
    "episode_id":"episode-1",
    "request_id":"req-1",
    "correlation_id":"corr-1",
    "policy_version":"1",
    "task":{
      "task_fingerprint":"sha256:taskfixture",
      "objective_preview":"[redacted:sha256:taskfixture len=4]",
      "task_type":"coding",
      "privacy":"internal",
      "risk":"medium",
      "required_capabilities":[
        "tools"
      ],
      "tools":[
        "search"
      ],
      "approvals_count":0,
      "context_keys":[],
      "metadata":{},
      "schema_version":"1"
    },
    "workflow":{
      "workflow_fingerprint":"sha256:workflowfixture",
      "plan_id":"plan-1",
      "step_count":1,
      "fallback_allowed":true,
      "fallback_step_count":0,
      "verification_checks":[
        "tests"
      ],
      "verification_plan_id":"verify-1",
      "policy_version":"1",
      "metadata":{},
      "schema_version":"1"
    },
    "outcome":{
      "outcome_fingerprint":"sha256:outcomefixture",
      "event_type":"completed",
      "outcome":"success",
      "occurred_at":"2026-07-16T12:00:01Z",
      "request_id":"req-1",
      "correlation_id":"corr-1",
      "decision":"selected",
      "policy_floor":"protected",
      "selected_route":{
        "runtime_id":"provider/model"
      },
      "verification":{
        "passed":true
      },
      "quality":{
        "score":0.9
      },
      "latency_ms":120,
      "cost":{
        "usd":0.01
      },
      "retries":1,
      "fallback_count":0,
      "provider_version":"provider-v1",
      "model_version":"model-v1",
      "details":null,
      "schema_version":"1"
    },
    "schema_version":"1"
  }
}
